title,desc,category,website,email,tel
デフィデ 株式会社,【JOB Scope】は、成長に特化した唯一の人事サービスです。新卒一括採用、年功序列、終身雇用などを特徴とする日本の古い人事制度はメンバーシップ型と呼ばれます。右肩上がりの経済では機能していましたが、昨今では問題点も指摘され、欧米流のジョブ型雇用が導入されるようになりました。しかし、海外の形をそのまま持ち込んでも、日本企業にはそぐわない点が多くあります。そこで私たちは、メンバーシップ型の利点も取り入れ、昇華した日本版ジョブ型人事制度を構築しました。公正で透明性が高く、多様性を受容し、自律した個人を育成する組織は、人材市場で強い組織。すなわち、重要な企業価値になるのです。 人事コンサルティングサービス【JOB Scope Model】では、日本企業に求められる職務を中心とした人事の仕組みを「戦略×人事×メソッド×コンサルティング×クラウド」の掛け算から企業の人事の型を体系的に導きます。現状（As is）とあるべき姿（To be）を定義し、経営戦略を人事戦略に落とし込み、成長に最適化した人事制度を設計します。 人事クラウドサービス【JOB Scope】では、【JOB Scope Model】で構築した人事のモデル（型）を制度設計し、具現化します。日本版ジョブ型人事制度を前提とした管理システムに個別の事業や職務を適用し、スムーズな運用サポートを実現します。,"HR EXPO （人事労務・教育・採用）, 人事評価システム",,,
株式会社 ジンジブ,株式会社ジンジブでは、能力をまだまだ軽視されている人財層を発掘する事業をドメインとし「採用・教育・定着」に貢献する事業を行っています。 〇高校生向け求人サイト「ジョブドラフトNavi」 〇高校生のための合同企業説明会「ジョブドラフトFes」 〇高校生へのキャリア教育支援「ジョブドラフトCareer」 〇高卒人材をメインとした若年層の転職サポート「ジョブドラフトNext」,"HR EXPO （人事労務・教育・採用）, 採用ツール作成, 採用代行・コンサルティング",,,
GVA TECH 株式会社,私たちGVA TECH株式会社は、「法律」と「すべての活動」の垣根をなくすことを使命とし、AIやクラウドを活用した法務支援ツールを提供することで、企業の法務部門が抱える課題を解決し、業務の効率化を図ります。 主なサービスには、法務案件管理やAI契約書レビュー、AI契約書管理理ステムが含まれ、これにより法務案件管理、これにより契約書の作成、レビュー、管理が一元化されるだけでなく、リスクの可視化と予防も実現します。 さらにスタートアップ企業向けの法務支援にも力を入れており、成長段階にある企業が直面する法的課題に対して、適切なソリューションを提供します。GVA TECHのサービスは、法務の専門家だけでなく、経営者や他のビジネスパーソンにも利用されており、全ての企業活動が法律とシームレスに統合される未来を目指しています。 以上のように、GVA TECHは、法律とテクノロジーを融合させることで、法務業務の効率化と革新を推進し、企業の成長を支援するパートナーとしての役割を果たしています。,"法務・コンプライアンス EXPO, 契約書作成・確認サービス, 契約書管理システム, その他 法務向けサービス, その他 知財向けサービス, ハラスメント対策支援",https://gvatech.co.jp/,mailto:lts.biz@gvatech.co.jp,tel:03-6274-8260
TUNAG（ツナグ）,TUNAG（ツナグ）は、組織のエンゲージメント向上と業務効率化を目的とした、社内向けの情報共有サービスです。高いカスタマイズ性が特徴で、各企業の組織課題に応じた施策の設計・運用・改善が可能です。また、導入から活用まで、専任スタッフによる支援が提供されるため、スムーズな運用が実現します。 スマートフォンでも手軽に利用できるため、PCやメールアドレスを持たない現場スタッフやアルバイトを含む全従業員が利用可能です。社内掲示板やチャット、タスク管理、サンクスカードなど、豊富な機能を通じて情報共有を円滑にし、コミュニケーションの活性化と業務プロセスのデジタル化を推進します。 さらに、理解度テストや日報、マニュアル管理など、業務に直結した機能を提供するとともに、福利厚生クーポンの発行などで、普段から使っていただきやすい設計になっています。 また、エンゲージメントサーベイ機能を通じて、組織状態を可視化・分析し、組織の現状把握や経営戦略の改善に役立てることができます。 TUNAGは業種業界問わず活用いただいておりますが、飲食業、小売業、運送業、製造業、介護業などノンデスクワーカーの多い企業で特にご利用が多く、現在900社以上、100万人以上のユーザーに活用されています。,"HR EXPO （人事労務・教育・採用）, 社内申請・ワークフロー, グループウェア・社内SNS・ビジネスチャット, 人事管理システム, オンボーディングツール, 従業員エンゲージメント向上, 従業員意識調査, コミュニケーションツール, 離職防止, 福利厚生ギフト",,,
株式会社 スピークバディ,AI英会話アプリ「スピークバディ」の企画・開発・運営。オンライン英語コーチング「スピークバディ パーソナルコーチング」の企画・運営。英語学習者の悩みにプロの英語コーチが回答するQ&Aサイト「スピークバディ 英語学習Q&A」の運営。AI英会話「スピークバディ」および「スピークバディ パーソナルコーチング」の法人向け提供。,"HR EXPO （人事労務・教育・採用）, リスキリング支援, グローバル人材育成・採用",,,
株式会社 SmartHR┃労務管理もタレントマネジメントも（HREXPOに出展！）,主な機能 ▼労務管理 入社手続き・雇用契約 給与明細 文書配付 年末調整 ▼従業員データベース 組織図 名簿 申請・承認機能 ▼タレントマネジメント 採用管理 人事評価 配置シミュレーション キャリア台帳 スキル管理 学習管理 従業員サーベイ 分析レポート HRアナリティクス ▼従業員ポータル IdP,"HR EXPO （人事労務・教育・採用）, 社内申請・ワークフロー, その他 DX・働き方改革関連サービス, 人事管理システム, 人事評価システム, 労務管理システム, その他 労務サービス, HRテクノロジー, ピープルアナリティクス, エンゲージメントツール, 社員研修サービス, リスキリング支援, コーチング, 採用管理システム, 従業員エンゲージメント向上, 従業員意識調査, 離職防止, メンタルヘルスケア/ストレスチェック, 産業医サービス, 従業員エンゲージメント, その他 健康経営サービス",,,
sonar ATS|Thinkings 株式会社,"採用管理システムsonar ATSをはじめとした、人材の獲得から活用まで一気通貫で対応可能なプラットフォーム「sonar HRテクノロジー」を運営しています。 新卒・中途を一元管理するsonar ATSは、採用業務のデジタル化を通じて、各種オペレーションの自動化や、データ分析による効率化を実現。採用担当者の業務負荷を大幅に削減します。1,800社以上が利用する採用管理システムの決定版です。","HR EXPO （人事労務・教育・採用）, 採用管理システム",,,
株式会社 TAO Partners,"人材開発・組織開発の専門企業として、生成AIなどのデジタル技術やゲーミフィケーションを活用した、イマーシブ研修を始めとした独自の人材開発ツールを製作・提供。組織コンサルティング事業でグローバル企業の要求に応える中で生まれたオリジナル研修コンテンツを、人事や経営企画を始めとして、研修会社や講師の方々にもご提供し、などの研修コンテンツとしてご利用いただいております。また、大手グローバル企業を中心としたクライアントに対し、次世代リーダー育成などの人材開発戦略立案やテーラーメイド研修、理念・方針の展開、新規事業立案サポートといった支援を提供しております。【※イマーシブ(没入型)研修 ＝ ""ストーリー""の登場人物となり自ら考え行動する中で実践力を鍛える形式のプログラム】","HR EXPO （人事労務・教育・採用）, 社員研修サービス, 職種別研修, 階層別研修, デジタル人材育成, グローバル人材育成・採用, 人材育成コンサルティング, チームビルディング支援, オンボーディングツール, 従業員エンゲージメント向上, 離職防止, 従業員エンゲージメント",,,
株式会社tayo,株式会社tayoはアカデミアの情報交流の促進と、アカデミックキャリアの多様化を目指す会社です。 広範な研究業界の人材ネットワークを用いて、・研究者人材のご紹介・研究者のスカウトサービスの提供・研究者の副業マッチング・産学連携・オープンイノベーションのサポート・ベンチャー企業のハンズオンのサポート・起業支援プログラムの運営などを行っています。,"HR EXPO （人事労務・教育・採用）, ハイクラス人材採用",,,
第一法規 株式会社,1. 加除式法規書の出版・販売 2. 学術書、実務書の出版・販売 3. 専門雑誌の出版・販売 4. デジタル商品の企画・販売 5. 特別受注出版物等の編集・印刷 6. 地方公共団体の地域施策に関する調査事業,"法務・コンプライアンス EXPO, 労務管理システム, 社員研修サービス, 職種別研修, 階層別研修, 契約書作成・確認サービス, 契約書管理システム, ハラスメント対策支援, コンプライアンス研修",,,
株式会社 チェンジ,"弊社は、日本の労働人口の減少を背景にした企業の生産性革新を支えるべく「Change People, Change Business, Change Japan」というミッションのもと、「人や組織」の変革を支援しております。 今回出展いたしますNext Learning eXeprience(人材育成事業部)では、企業の人財育成制度設計コンサルティング、研修・設計開発・運営サービス、デジタル人材育成ソリューションを提供しております。","HR EXPO （人事労務・教育・採用）, 社員研修サービス, リスキリング支援, 職種別研修, 階層別研修, デジタル人材育成, 人材育成コンサルティング, チームビルディング支援, コーチング, その他 教育・人材育成サービス",,,
中京テレビ放送株式会社,私たちは、愛知・岐阜・三重を放送地域とする日本テレビ系列のテレビ局「中京テレビ」の新規事業開発チームです。55年に渡り、テレビやイベントを通じて培ってきたコンテンツ開発力と、グループ会社「アクアリング」のWEB制作力を掛け合わせて、企業の課題をエンタメで解決するサービスを各種取り揃えております。 昨年の11月には、集客に苦戦する合同就職説明会をメタバースでアップデート。「メタバースで、楽しく、タイパよく」をテーマにしたメタバース就職フェア「メタイパ就活」を開催しました。 さらに、採用活動の根本的課題である母集団形成を「分散型メディア」の発想で支援する「採用TV」は、SNSやYouTube、TikTokといった外部メディアで学生との接点を作り、採用サイトへの流入を増やす施策を提案いたします。 そして、研修会社との協業で開発したRPG型研修サービス「社員クエスト」は、メタバースのゲーム性と匿名性を活用して、心理的安全性の高い環境下で研修を実施することのできるシステムとなっております。デモ空間もご覧いただけますので、ぜひお気軽にお立ち寄りください！,"HR EXPO （人事労務・教育・採用）, 社員研修サービス, 職種別研修, 階層別研修, チームビルディング支援, その他 採用サービス, 従業員エンゲージメント向上",,,
TSUISEE,提供するアプリケーションはTSUISEE（ツイシー）。私たち自身はMaxwell's HOIKORO（マクスウェルズ　ホイコーロー）と言います。いわゆるデータサイエンス技術を用いた、HRテック分野のスタートアップ企業です。 しかし私たちは同時に、株式会社Consulente HYAKUNENとしてコンサルティングを行うチームでもあります。正確には、大手シンクタンクにて企業の変革・成長支援を多数行ってきたメンバーと、人材育成を通して地方創生に取り組む人材、社会的課題解決に従事する研究者、経営学者からなるコンサルファームです。 経営学だけでなく、脳科学、心理学、哲学、歴史、などさまざまな分野の理論・知見とデータ解析技術をもとに、大・中規模企業を中心にした幅広い組織・団体に対し、全社変革や事業創造、人材・組織創りを行っています。 企業変革の実践経験と分野横断の学術的知見を同居させ、それらを駆使することから、変革を確実に実現へと近づけることに取り組んできました。,"HR EXPO （人事労務・教育・採用）, HRテクノロジー, ピープルアナリティクス, エンゲージメントツール, 社員研修サービス, 職種別研修, 階層別研修, 人材育成コンサルティング, その他 教育・人材育成サービス",,,
株式会社 ティーズブレイン,私たちティーズブレイングループは、人材・組織・環境を「その企業らしく」活性化させるお手伝いをし、お客様の事業課題の解決とともに企業価値(ブランディング)向上に貢献できる会社です。お客様企業の「らしく働く」を追求し、企業と社員の皆様の幸福と豊かさを最大限に実現するために一緒に伴奏し続けます。 　事業課題の解決のためには、経営が目指す人・組織・環境のあるべき姿を明確にし、これからの働き方コンセプトを実現できるオフィス環境とセットで具体化する必要があります。これからの働き方を具現化できる「オフィス構築・移転事業」、これからの働き方コンセプトを形骸化させないPMVVの浸透、働く環境や機能性(DX)向上＆業務プロセス改革、人材・組織の能力開発・制度構築を行う「CXかえる事業」、採用ブランディングや離職予防を行う「HRひらく事業」という全体最適な事業フォーメーションでご支援します。,"働き方改革 EXPO, HR EXPO （人事労務・教育・採用）, その他 DX・働き方改革関連サービス, オフィスデザイン・移転・コンサルティング, 社員研修サービス, 階層別研修, 人材育成コンサルティング, チームビルディング支援, コーチング, その他 教育・人材育成サービス, 従業員エンゲージメント向上, 従業員意識調査, 離職防止",,,
株式会社 テイ・デイ・エス,テイ・デイ・エスは、創業45年目を迎えるデザイン・ファームです。 約110名の社員の9割はクリエイターです。 「Strategic design and Creative logic―デザインに戦略性を、ロジックに創造性を」を スローガンに掲げ、デザインの力でお客様の課題解決に貢献します。 これまで数々の大型プロジェクトに取り組んできたプロジェクト遂行力、45年分のデザインメソッド、サービス開発や課題発掘といった上流工程からの伴走力を武器に、エンドユーザーへのブランド体験をクライアントと共創しながら適切に企画・設計します。,"PR EXPO, 従業員エンゲージメント向上, コミュニケーションツール, 広報業務支援サービス, 社内広報支援サービス",,,
株式会社 テックオーシャン,"『TECH OFFERは企業が本当に求める理系学生に出会える採用ツール』 TECH OFFERは、企業と理系学生間のマッチングを、高精度かつ効率よく実現するダイレクトリクルーティングツールです。学生自身が入力する表向きなプロフィールだけではなく、全国約40,000の研究室・教員情報、約1,000,000の技術キーワードに基づいてマッチングを行うため、今までに出会えなかった学生と出会うことができます。 TECH OFFERで解決できること 01 学生からの知名度が低い企業でもアプローチ・学生獲得が可能です 02 母集団形成にかけている工数を削減できます 03 企業イメージとギャップがある職種・事業領域でも学生にリーチできます","HR EXPO （人事労務・教育・採用）, 採用管理システム, ハイクラス人材採用",,,
寺田倉庫株式会社,1950年創業の寺田倉庫は、従来の倉庫業の概念をさらに深化させ「モノだけではなく、価値をお預かりする」という理念に基づき、機密文書の保管を軸に、お客様の働く環境をより良くするお手伝いをしております。 現在2500社を超えるお客様とお取引させていただいており、長期にわたりお客様とパートナーシップを築いている実績もございます。,"法務・コンプライアンス EXPO, 機密文書処理サービス, BPO（業務代行）サービス, テレワーク・ハイブリッドワーク支援, 契約書管理システム",,,
株式会社 DYM,当社では自社内で開発チームを保有しており、Indeed内のアルゴリズムを独自のシステムで解析することで、より精度の高い運用を行うことが可能です。WEBプロモーション事業と人材事業でトップクラスである当社だからこそ、Indeedの運用に携わる全てのことを社内で行うことができます。また、クライアントの採用プロモーションをトータルで請け負っており、クライアントの採用活動においての改善点をシステム部分から提案することが可能です。 Indeed代理店の中で、唯一の人材事業とWEB広告事業のノウハウを持っている という強みを使い、クライアントの採用活動の業績改善に助力してまいります。,"HR EXPO （人事労務・教育・採用）, 採用代行・コンサルティング",,,
東京都　こどもスマイルムーブメント,こどもスマイルムーブメントは企業・NPO・学校など幅広い主体と東京都が連携して、「子供を大切にする社会」をつくるプロジェクトです。参画企業・団体の取組をホームページや公式SNSアカウントでの発信等を通じ、社会全体で「子供を大切にする」気運の醸成を目指しています。また、コラボレーションを支援するため、参画企業・団体同士の交流会等を開催しています。,PR EXPO,,,
TOMAコンサルタンツグループ 株式会社,「どんな課題もチカラを合わせて越えていく」　　　　　　　　　　　　　　　　　　　　　　　　　　　　　　　　　　　　　　　　 ◆TOMAのワンストップコンサルティング　　　　　　　　　　　　　　　　　　　　　　　　　　　　　　　 各分野の専門家がそろうワンストップ体制という強みを生かし 専門分野の垣根を越えて企業の課題を総合的に解決する”ワンストップコンサルティング”。 100年企業創りのためにTOMAグループの総力を結集し一丸となって課題解決に取り組みます。　　　　　　　　　　　　　　　　　　　　　　　　　　　　　　　　　　　　　　　　　　　　　　　　　　　　　　　　　　　　　 ◆200名の専門家集団がワンストップでサポート　　　　　　　　　　　　　　　　　　　　　　　　　　　　　 私たちは税理士、公認会計士、社会保険労務士、ITコンサルタント、中小企業診断士、行政書士など、 様々な分野の専門家が総勢２００名揃った専門家集団です。 日本一多くの１００年企業を創り続けるというビジョンのもと、皆様の経営課題の解決に向け サポートいたします。,"HR EXPO （人事労務・教育・採用）, 会計・財務 EXPO, BPO（業務代行）サービス, 社内申請・ワークフロー, AI・RPA（業務自動化）ツール, 勤怠管理システム, 給与計算システム, その他 労務サービス, 会計システム, 経費精算システム, 会計コンサルティング, 財務コンサルティング, 事業承継・M＆Aサポート, その他 経理・財務・税務サービス",,,
株式会社 日本コンサルタントグループ,<日本コンサルタントグループの強み＞ お客様ごとの特性、すなわち商習慣、組織風土・文化を把握するとともに、そこから発生する複雑な問題に対してお客様にあったソリューション（解決）を提供するために、「真に役立つコンサルティング」を常に研究しています。 １）企業経営の基盤である「人材」に焦点を当てたコンサルティング 企業のビジョンや戦略に合致した人材育成輩出するための制度やしくみを構築し、能力開発のための教育プログラムの構築やトレーニングを通して、企業の目標達成のサポートをします。 ２）業界に精通した専門コンサルタントが現場の課題に対応 業界研究所を設置し、業界特性に適応した専門性の高いコンサルティングサービスを展開し、課題に対応しています。 ３）全国の営業拠点と60年以上の実績でクライアントを支援 地域特性や地域ごとのニーズをとらえるための全国の営業拠点と、60年以上の実績による数多くのクライアントに対する成功事例、豊富な経験でクライアントへ支援しています。,HR EXPO （人事労務・教育・採用）,,,
NewsPicks,個人・法人向けにさまざまなサービスを展開 メディア・プラットフォーム事業を起点に、コミュニティの運営、専門家ネットワーク事業、企業向けの人材育成・新規事業支援など、複数の事業・サービスを展開しています。 経済情報（コンテンツと人の知見）の力で、誰もがビジネスを楽しめる世界を目指します。,"HR EXPO （人事労務・教育・採用）, リスキリング支援, デジタル人材育成, その他 教育・人材育成サービス, コミュニケーションツール",https://newspicks.com/,,
株式会社 ネオキャリア,,"HR EXPO （人事労務・教育・採用）, 採用代行・コンサルティング",,,
