title,desc,category,website,email,tel
Ｒｅ就活（株式会社学情）,会員数230万人の「20代向け転職サイト6年連続No.1・20代専門転職サイト〈Ｒｅ就活〉」（2019年～2024年 東京商工リサーチ調査 20代向け転職サイト 第1位）や、会員数40万人の「オリコン顧客満足度(R)調査 学生満足度3年連続No.1・スカウト型就職サイト〈あさがくナビ（朝日学情ナビ）〉」（※2022年～2024年 オリコン顧客満足度(R)調査 逆求人型就活サービス 就活支援コンテンツ 第1位）を軸に、業界で唯一20代の採用をトータルにサポートする大手就職・転職情報会社です。 また日本で初めて「合同企業セミナー」を開催し（自社調べ）、合同企業セミナーのトップランナーとして、20代来場数No.1の「20代・30代対象の合同企業セミナー〈転職博〉」（2020年 自社調べ 転職イベントにおける20代来場数 第1位）や、新卒学生対象・合同企業セミナー来場数No.1「合同企業セミナー〈就職博〉」（2023年 東京商工リサーチ調査 新卒学生対象・合同企業セミナー 来場数 第1位）を運営。,"HR EXPO （人事労務・教育・採用）, 採用管理システム, 採用ツール作成, 採用代行・コンサルティング, その他 採用サービス",,,
企業年金連合会,年金給付事業（通算企業年金等）、会員支援事業（政策提言、研修、セミナー、機関紙、書籍、ホームページ作成、事例相談、企業年金管理士資格認定）、私的年金制度普及事業（投資教育サービス、海外調査、企業年金導入支援）、共同運用事業、企業年金プラットフォーム事業、企業年金ネットワーク事業、企業年金スチュワードシップ推進協議会、企業年金向け各種情報提供など,"HR EXPO （人事労務・教育・採用）, 福利厚生 EXPO, その他 教育・人材育成サービス, その他 福利厚生サービス",https://www.pfa.or.jp/,mailto:pfa-edu@pfa.or.jp,
株式会社 キッズスター,キッズスターは「子どもの夢中を育てます」というミッションのもと、子ども向けプロダクトを企画・開発・運営している会社です。 社会体験アプリ「ごっこランド」をはじめ、様々なプロダクトを通じてこれまでに100社以上の企業様のファミリー向けマーケティング・ブランディングを支援してまいりました。 子どもに寄り添ったプロダクトを徹底して作り続けることで、 子ども達が夢中になる体験を創出していきます。 社員一人ひとりがプロダクト愛に溢れており、子どもたちが自分の好きなこと・得意なことを見つけ、将来につながるような流れを作り出すといった想いをもって、日々様々な挑戦をしています。,"PR EXPO, その他 教育・人材育成サービス, 従業員エンゲージメント向上, 従業員エンゲージメント, 広報業務支援サービス",,,
株式会社KiteRa,企業向け規程マネジメントシステム【KiteRa Biz】を提供しております。 KiteRa Bizとは、社内規程の作成・編集・管理・共有・申請の一連のプロセスを統合管理するシステムです。 統合管理することで各プロセスの業務を効率化し、企業のガバナンス向上を実現します。 展示ブースでは実際にKiteRa Bizのデモ画面をご覧いただけます。ぜひお気軽にお立ち寄りください。 株式会社KiteRaはテクノロジーの力で安心して働ける世界を実現し、より豊かな社会を創造することを目指しています。 「安心して働ける」ためには、働き方のルールや仕組みが正しく整っていることが必要です。 私たちはテクノロジーの力で社内規程の作成や運用をカンタンにし、より多くの企業が適切な社内ルールを通じて、企業の、そして働く人の生産性を高めていきます。,"HR EXPO （人事労務・教育・採用）, その他 オフィス向けサービス, その他 DX・働き方改革関連サービス, その他 労務サービス, HRテクノロジー, その他 法務向けサービス",https://kitera-cloud.jp/,,tel:0345002438
KING OF TIME,"株式会社ヒューマンテクノロジーズは「人事生産性をお客様と共に考える。」をコンセプトに2001年創立以来、クラウドコンピューティングをベースとし、業務システムと生体認証技術を融合した製品サービスを提供して参りました。お手持ちのPCとインターネットだけで簡単で高度な勤怠管理を行うクラウド勤怠システム「KING OF TIME」は、勤怠クラウド市場シェアNO.1*の実績を持ち、導入企業数56,000社、利用ID数3,349,000IDを達成（2024年7月時点）。多岐にわたる人事・労務の作業効率化とコスト削減を実現します。*出典：富士キメラ総研「ソフトウェアビジネス新市場 2023年版」勤怠管理ソフトSaaS市場 利用ID数 2022年度実績","HR EXPO （人事労務・教育・採用）, テレワーク・ハイブリッドワーク支援, 人事管理システム, 勤怠管理システム, 給与計算システム, 労務管理システム, その他 労務サービス, その他 セキュリティ製品・サービス",,,
KEYENCE CORP.,キーエンスは1974年の会社設立以来、FA（ファクトリー・オートメーション）用センサをはじめとする高付加価値商品を通じて、生産現場の生産性・品質向上に貢献して参りました。 自動車、半導体、電子・電気機器、通信、機械、化学、薬品、食品など、製造業のあらゆる分野において30万社以上のお客様にお取引いただいております。,"働き方改革 EXPO, HR EXPO （人事労務・教育・採用）, オフィス防災 EXPO, 福利厚生 EXPO, 会計・財務 EXPO, 法務・コンプライアンス EXPO, 総務サービス EXPO, AI・RPA（業務自動化）ツール",,,
株式会社 ギフティ,giftee for BusinessはWebサービス、ゲーム、教育、銀行、クレジットカード、保険、自動車、不動産、人材、携帯通信など、様々な業界でご利用いただいており、累計導入件数は1万件以上にのぼります。 キャンペーンの施策はもちろん、誕生日のお祝いから永年勤続表彰まで幅広いシーンで従業員エンゲージメントを高める福利厚生・ギフト施策をご提供しています。 関連サイト：https://giftee.biz/purposes/employee_benefit/ またユーザー自身が好きな商品を自由にえらべる「giftee Box」では、コンビニやカフェ、ファッションからレジャーまで幅広いシーンのギフトを取り揃えています。 ▼3分でわかる！「giftee for Business」とは https://docs.giftee.biz/business/downloads/gifteeforBusiness_3minutes.pdf ▼ギフト利用目的や業界別に検索できる！実現したいことが見つかる事例サイト https://giftee.biz/cases/ お問い合わせ・ご相談はこちら：https://giftee.zendesk.com/hc/ja/requests/new 公式サイト：https://giftee.biz/,"HR EXPO （人事労務・教育・採用）, 福利厚生 EXPO, 健康経営 EXPO, コーポレートギフト, 従業員エンゲージメント向上, 福利厚生ギフト, 育児・介護支援, エンタメ, 従業員エンゲージメント",,,
株式会社 Techouse,"Techouseは国内1,000万人以上が従事する製造業を中心に、アナログな産業をデジタル化する会社です。現在はトヨタ, ホンダ, デンソーなど国内を代表する企業が利用しており、サービスの利用ユーザーは年間500万人にも上ります。",HR EXPO （人事労務・教育・採用）,,,
glassy　株式会社,glassy株式会社はインナーブランディング活動を中心に戦略提案を行うことで、企業が目指すありたい姿へと導くクリエイティブカンパニーです。下記 3 領域をソリューションとし、クライアント企業のブランド力の最大化とインナーコミュニケーションの活性化をトータルで支援しています。 01) コーポレートブランディング事業・・・付加価値の高い制作ツールの提供（社内報、記念誌、周年誌、カルチャーブック、コーポレートサイト、採用パンフレット など） 02)コミュニケーションTech事業・・・人と組織の間に新しいコミュニケーション機会を提供（WEB社内報システムの開発・提供 など） 03)イベントプロデュース事業・・・ぐっと来る”瞬間”と、大切なものを共有する”空間”の提供（キックオフイベント、社員総会、表彰イベント、周年記念イベント など）,"PR EXPO, 広報業務支援サービス, 社内広報支援サービス",,,
株式会社グローアップ,新卒向けダイレクトリクルーティングシステム『キミスカ』運営,"HR EXPO （人事労務・教育・採用）, その他 採用サービス",,,
株式会社 グロース X,人材育成サービスの「グロースＸ」は、業績向上に繋がるまでを考え抜いて創ったサービスです。 磨きあげた網羅的マーケティングカリキュラムと、チャット形式というユニークなe-ラーニングを筆頭に、学びを実践につなげる体験作りまでを大切に磨き、ワンストップで皆さまに届けています。 今後のビジネス環境においてマーケティングの重要度は上がっていきます。 特定の専門領域にとどまらず、顧客体験全般、ビジネス全般を作るために無くてはならない役割ですが、激動の時代に顧客の変化を素早くつかみ、 仮説検証を回せるかは、将来の成否のカギとなるでしょう。 現場の力がアップすると、必ず業績アップに繋がります。 コンサルティング支援で多くの企業の業績を伸ばしてきた、人材育成、組織作りのノウハウをお届けします。,"HR EXPO （人事労務・教育・採用）, 社員研修サービス, リスキリング支援, 職種別研修, デジタル人材育成",,,
株式会社 グロービス,"株式会社グロービスは、1992年の設立以来、30年以上企業研修に向き合ってきた知見や、国内最大規模のビジネススクール「グロービス経営大学院」の運営によって培ったノウハウをもとに、「GLOBIS 学び放題」や「GLOPLA LMS」などのサービスを展開しています。 「GLOPLA LMS」は、6,700社超の研修実績をもとに設計されたUI/UXで、快適な研修設計と受講体験をお届けする学習管理システム（Learning Management System）です。直感的に操作できるデザインとこだわりぬかれた機能により、集合研修や動画学習、e-Learning などさまざまな研修の一元管理を実現します。グロービスならではの知見を活かし、企業の人事担当者の業務フローに合わせた最適な研修運用・導入計画のサポートを提供。これにより、研修を企画・運営する人事担当者は、従来、研修運営のオペレーション業務に使っていた時間を大幅に削減することができます。また、研修を受講する社員は、スマートフォンやタブレットなどデバイスを問わずアクセスすることができ、いつでも快適に学習することが可能です。","HR EXPO （人事労務・教育・採用）, 人事管理システム, HRテクノロジー, 社員研修サービス, その他 教育・人材育成サービス",,,
株式会社 ケイズコーポレーション,■ケイズのサービス 最新のクラウド技術を利用した各種アプリケーションサービスを、提案から稼働後のご支援まで、システムの入口から出口まで、お客様のニーズに合わせたサービスを提供しております。 スピード重視の簡易導入から、大規模な開発を要する複雑なご要件、稼働後の活用向上など、まずはお気軽にお声がけください。 ■Salesforce導入支援 ＜将来も陳腐化しない業務システムを＞ Salesforce® が世界中で採用されている理由。 それはビジネス環境やIT環境の変化にすばやく対応できる柔軟性にあります。 当社ではコンサルティングから運用保守までのワンストップ体制を活かし、 お客様からの改善要求や機能追加のご要望に対応。ご希望であれば改善提案もおこない、システムのさらなる強化を図ります。,"HR EXPO （人事労務・教育・採用）, その他 DX・働き方改革関連サービス, 人事管理システム, 人事評価システム, HRテクノロジー, ピープルアナリティクス, 採用管理システム, 離職防止",,,
株式会社 コングレ・グローバルコミュニケーションズ,当社は、MICE業界のリーディングカンパニー、株式会社コングレのグループ会社です。 ISO基準に適合した安心の品質体制と、熟練したコーディネーターによる迅速で細やかな対応が特長の翻訳サービス。 高度な通訳スキルときめ細かなアレンジ力で「コトバ」をつなぐをモットーに数多くの国際舞台や多様なビジネスシーンにおいて、通訳のサービスを提供してきた通訳サービス。 イベント対応のエキスパートが、説明会やイベントの会場手配から企画立案、運用・運営までを一手に引き受け、ライブ配信や動画配信、オンライン・オフラインを問わず、イベント対応をトータルサポートするイベントサービス。 各サービスをシームレスにお客様とつなぎ、みなさまのプロジェクトの成功をサポートします。,"PR EXPO, グローバル人材育成・採用, 人材派遣, 従業員エンゲージメント, 広報業務支援サービス, 社内広報支援サービス, IR支援サービス",,,
三協立山 株式会社,三協立山は植物工場プラントメーカーとして、業界トップの生産能力を持った栽培設備と圧倒的な栽培技術力、衛生管理や生産管理などの工場運営ノウハウ、ネットワークを活かした販路紹介で、不採算要因を取り除いた植物工場運営を支援しています。合わせて、誰もが働きやすい職場づくり、障がい者雇用、ストレス軽減の観点から癒しの場として、小型水耕栽培ユニットも提案しています。,"HR EXPO （人事労務・教育・採用）, 障がい者雇用",,,
サンクスラボ 株式会社,サンクスラボは障がい者雇用の課題を解決する「サテラボ」を提供している企業です。 法定雇用を満たせない企業への支援や、人材確保・育成の困難を解消するためのサービス、日々の管理負担を軽減する支援、さらには仕事提供に関する業務切り出しの提案まで、障がい者の雇用に関するあらゆるニーズにワンストップで対応しています。,"HR EXPO （人事労務・教育・採用）, BPO（業務代行）サービス, 障がい者雇用, 従業員エンゲージメント向上",,,
Sansan 株式会社,Sansan株式会社は「出会いからイノベーションを生み出す」をミッションとして掲げ、働き方を変えるDXサービスを提供しています。主なサービスとして、営業DXサービス「Sansan」や名刺アプリ「Eight」、インボイス管理サービス「Bill One」、契約データベース「Contract One」を国内外で提供しています。,法務・コンプライアンス EXPO,,,
株式会社XAION DATA,「AI×DATAで世界中の価値を最大化する」をミッションに、世界中のデータ価値を見出し、最大化する仕組みを提供することで、人の幸福への寄与及び社会への貢献を実現します。 AI×DATAを技術基盤とし、データの構造化・統合AI技術（特許取得済み）の研究開発を行い、HR領域や営業領域などでAI/データ活用ソリューション・サービスを提供しています。 「AUTOHUNT」は、既存の登録型採用サービスとは異なり、転職サービス等に登録されていない非登録ユーザーをウェブ上のさまざまな公開データを活用してプロファイルを生成し、検索・アプローチができる採用プラットフォームです。 780万人を超えるプロファイル情報と500万社以上の企業情報を統合し、従来のクローズ型の採用データベースでは見つからなかった人材を、人・企業の双方の検索条件から横断的に検索することが可能で、情報が一元化されているため、従来手作業で実施する必要があった検索工数も大幅に削減できます。,"HR EXPO （人事労務・教育・採用）, ハイクラス人材採用",,,
株式会社シェイク,株式会社シェイクは、人材育成トータルソリューションを提供する会社です。 私たちは、研修会社ですが、研修だけで人は変わらないと思っています。 研修はあくまでもきっかけに過ぎません。大切なのは、研修で学んだこと、 気づいたことをいかに職場で実践するか。人は、自らの行動によって得た経験に よってのみ変わることができます。 もちろん、研修の品質にもどこよりもこだわっていると自負していますが、 私たちが何よりも大切にしたいのは、「それで本当に人が変わるのか？」という問いに 対する答えです。 弊社の強み ①企業様にとってベストなソリューションをご提案 弊社が販売したい商品をご提案するのではなく、人材育成施策の目的を お客様と一緒に考え、各企業様の状況や受講者の特徴も踏まえながら最適な プログラムを提供します。 ②研修前後を含めて行動変容のトータルデザイン 研修で理解して終わりではなく、職場での行動変容を目指して、研修の前後を 含めた行動変容のトータルデザインをご提案します。 ③成長への意思を醸成する内省へのこだわり いくら研修で行動変容の必要性を訴えたり、スキルを伝えても、 本人が心から変わりたいと思わなければ職場での行動を変えることは難しいです。 シェイクは、研修前後を含めたさまざまな仕掛けを通して受講者の内省を深め、 変わりたいという意思を醸成することにこだわっています。,"HR EXPO （人事労務・教育・採用）, 社員研修サービス, 階層別研修, 人材育成コンサルティング, チームビルディング支援, その他 教育・人材育成サービス",,,
株式会社 識学,識学は、経営者・マネージャー・部下、すべての社員が無駄なストレスなく、自らの役割に集中できる組織を作り上げ、成果をあげる為のマネジメント理論です。これにより自己成長を促進し、組織と社員に、よりよい未来と成長をもたらします。 人が物事を認識し、行動に至るまでの思考の働きを5つの領域で説明しています。人はそれぞれ過去の経験や知識によって、その人特有の「思考の癖」を持ちます。この思考の癖によって、事実に対する認識にズレが生じ、これが誤解や錯覚となります。この誤解や錯覚こそが、組織運営に問題をもたらす原因となります。 識学は、思考の癖に紐づく誤解や錯覚の発生要因を特定し、これを発生させないためのマネジメント手法を体系化させたものです。 ルール作成や役割定義表の作成サポートや評価制度構築など組織と個人を成長拡大させるための仕組みづくりをサポートさせていただきます。,"HR EXPO （人事労務・教育・採用）, 人事評価システム, 社員研修サービス, 階層別研修, 人材育成コンサルティング, その他 教育・人材育成サービス",,,
SysEvo,SysEvo（システム・エボリューション株式会社）は、ITサービス業、主にソフトウェアの開発を行っております。 Web系の技術者を中心に、金融系システムから通信ネットワーク分野、組込系開発など幅広い分野の開発をしております。 システムの導入に向けたコンサルティングから、開発・保守・運用に至るまでトータル的なITコーディネートが可能です。 自社開発商品としては、企業と内定者のコミュニケーションをサポートするSNS型クラウドサービス『縁～AnySEE～』の販売を行っており、多くの企業様の人事担当の方よりご好評いただいております。 一方、教育事業も展開しております。 新入社員研修や社員のリスキリングに活用できる動画サービス『エボテック』は、当社公式キャラクターの「エボタロウ」が講師となり、わかりやすい解説のマイクロラーニング動画で学ぶことができる、ITエンジニア育成サービスです。 さらに『エボテック』を活用しつつ弊社講師が直接指導を行うオンライン研修『エボテックスクール』も開講しております。自社開発商品はその他にも、子供向けプログラミング学習ツールや高校向け「情報Ⅰ」学習コースもございます。 また、展示会などでお客様にアンケートに答えていただき、その結果を集計・管理できるアンケートアプリ『Q*A（キュア）』の新規販売を予定しております。,"HR EXPO （人事労務・教育・採用）, 人事管理システム, 社員研修サービス, リスキリング支援",https://sys-evo.co.jp/,mailto:lists-product-support@sys-evo.co.jp,tel:03-6262-5930
株式会社 　シスプロ,"シスプロは""仕組みをプロデュースする""総合アウトソーシング企業です。勤怠管理、電子給与明細、電子請求書・給与前払などのsaasやシステム、総務業務、経理業務といったバックオフィスのアウトソーシングや、様々なBPO事業、RPAや人材サービスといった、世の中の変化に即した企業運営に必要な、多岐に渡るサービスをDX戦略に基づき提供しており、これらサービスを組合せることでお客様の生産性向上に大きく貢献しております。","HR EXPO （人事労務・教育・採用）, BPO（業務代行）サービス, AI・RPA（業務自動化）ツール, 人事管理システム, 勤怠管理システム, その他 労務サービス, 請求書の電子化",https://hybridbpo-syspro.net/,mailto:y.takeyama@syspro.co.jp,tel:03-6664-9048
株式会社 JSH,『就労意欲のある障がい者に、もっと働ける機会と場を提供できる社会へ』 地方の障がいのある方にとって、民間企業への就労機会は非常に限られた状況にあります。地方においては雇用義務のある企業が都市部に比べて圧倒的に少ない事がその要因です。都市部と地方の絶望的な就労機会の格差を解消するために、私たちは精神科医療の専門的なバックグラウンドに加え、作業療法士や精神保健福祉士、ジョブコーチ等の専門的な知見と経験を活かし、「雇用を実現したい企業」と「働く意欲のある障がいのある方」の双方に対して、合理的配慮に基づいた職場と就労のための最適な支援をご提供いたします。,"HR EXPO （人事労務・教育・採用）, 採用代行・コンサルティング, 障がい者雇用",,,
株式会社 JITSUGYO,「採用アニメーションによる採用支援」 年間400本以上の実績。顧客満足度95％。人事担当者による10分間のプレゼンよりも、3分のアニメーションが約22%記憶効果が高いことが実証。 「より多くの人に伝えるためのYoutube広告運用」 「国家資格キャリアコンサルタントによる根本解決コンサルティング」,"HR EXPO （人事労務・教育・採用）, 採用ツール作成",,,
株式会社 Ex-Work,Job-Us（ジョブアス）は、生成AIによるジョブディスクリプション作成や、職務評価・職務給運用、職務と人材のFit＆Gap分析など、ジョブ型組織に必要な要素を、テクノロジーの力で実現します。,"HR EXPO （人事労務・教育・採用）, HRテクノロジー",https://job-us.exwork.jp/,mailto:info@exwork.jp,
