title,desc,category,website,email,tel
jinjer 株式会社,「ジンジャー」は、人事労務・勤怠管理・給与計算などの人事の定型業務から人事評価・eラーニングといったタレントマネジメントまで、1つにまとめて管理できるクラウド型人事労務システムです。 人事情報を1つに統合した「Core HRデータベース」によって、勤怠集計からの給与計算や、社会保険手続きに関する帳票類の入力といった定型業務の効率化・自動化を支援します。 また、それぞれのシステムのデータベースがつながっているため、データベースの自動反映や役割変更に応じた各システムへの権限変更の自動化などを実現します。,"人事管理システム, 勤怠管理システム, 給与計算システム, 人事評価システム, 労務管理システム, その他 労務サービス, HRテクノロジー, その他 福利厚生サービス, 経費精算システム",https://hcm-jinjer.com/,,
株式会社 チームスピリット,"私たちTeamSpiritは、「すべての人を、創造する人に。」というミッションを掲げ、創造性豊かでイキイキと働ける持続可能な社会を創出することを目指しています。2011年にローンチした「チームスピリット」シリーズは、業務の効率化にとどまらず、AIを活用する時代においても人々を貴重な資本と位置づけ、創造的な働き方をサポートする働き方改革プラットフォームとして多くの方々にご活用いただいています。 「チームスピリット」は、使いやすいUI/UXを通じて活動データを一元的に登録し、勤怠管理、経費精算、工数管理などに活用することができます。また、これらのデータを組み合わせて分析することで企業の内部統制を実現し、働く人々に価値のある情報を提供できます。このような知的生産の促進と従業員のウェルビーイング向上の取り組みは、お客様企業の成功の源泉と考え、継続的に進化させてまいります。。現在までに約1,800社、52万人以上のお客様にご利用いただいており、「データの見える化」で、企業の内部統制強化や労働生産性向上をご実感いただいております。","HR EXPO （人事労務・教育・採用）, 社内申請・ワークフロー, その他 DX・働き方改革関連サービス, 人事管理システム, 勤怠管理システム, 労務管理システム",https://www.teamspirit.com/,mailto:mk@teamspirit.com,tel:03-4577-7510
株式会社 ユーキャン,法人従業員向けの資格取得・リスキリング支援 通信教育講座、eラーニング、研修の提供,"HR EXPO （人事労務・教育・採用）, 社員研修サービス, リスキリング支援, 職種別研修, 階層別研修, デジタル人材育成, グローバル人材育成・採用, 人材育成コンサルティング, チームビルディング支援, コーチング, その他 教育・人材育成サービス",https://www.u-can.co.jp/houjin/,mailto:sales-rep@u-can.co.jp,tel:03-3377-1181
アクアクララ 株式会社,清涼飲料水製造・宅配事業,"福利厚生 EXPO, PR EXPO",,,
株式会社 アスマーク,Humapは調査業界で20年の実績を持つアスマークから生まれたHRTechサービスです。 Humapでは「従業員総活躍」を理念に、6つのサービスを提供しています。 従業員ひとりひとりが”自分らしく”活躍できる、そんな環境づくりをしたい方はぜひお立ち寄りください。 ①在席管理＆コミュニケーション活性化ツール「せきなび」 ②コンプライアンス＆ハラスメント対策「CHeck」 ③従業員満足度調査「ASQ」 ④オンラインサンクスカード「Smileボーナス」 ⑤業務効率化「RPA-Work's HR」 ⑥モチベーション管理「Pulsign」,"HR EXPO （人事労務・教育・採用）, テレワーク・ハイブリッドワーク支援, その他 DX・働き方改革関連サービス, エンゲージメントツール, 職種別研修, 階層別研修, オンボーディングツール, 従業員エンゲージメント向上, 従業員意識調査, コミュニケーションツール, 離職防止, その他 福利厚生サービス, 従業員エンゲージメント",,,
AME&Company 株式会社,離職対策、エンゲージメント、多様性の促進など人的資本の課題に対して、「HR pentest」は従業員との対話（面談）を活用することで、個人の悩み事も組織の課題もデータドリブンに分析することが可能なシステムです。 自社にどんな課題があって、どんな施策を打つべきか、をデータに基づいて意思決定したい企業様におすすめです。,"HR EXPO （人事労務・教育・採用）, その他 DX・働き方改革関連サービス, HRテクノロジー, ピープルアナリティクス, エンゲージメントツール, その他 採用サービス, 従業員エンゲージメント向上, 従業員意識調査, コミュニケーションツール, 離職防止, 従業員エンゲージメント",,,
EAGLYS 株式会社,EAGLYSは、秘密計算とAI設計技術によって、様々なインダストリーデータの活用を促進しています。 「秘密計算を中心としたセキュアコンピューティング技術」を生かしたデータセキュリティ/データ利活用サービス、「AIアルゴリズム設計・解析技術」によるAI開発/解析サービスを提供。 人事領域向けソリューション「EAGLYS Bianca」は、従業員の機微な情報であるために活用が難しいとされてきたHRデータに「秘密計算」を適応して分析することで、働く人の「真実」に基づく持続可能な人的資本形成を支援するプロダクトです。 創業より研究・社会実装を続けてきた「秘密計算」など各種技術を応用して、安全に労力をかけることなく、働く人にまつわる機微なデータの活用を加速させます。信頼性の高いデータを得ることで、洞察を得る仕組みを提供します。 （HP：https://eaglys.co.jp/about-us/）,"HR EXPO （人事労務・教育・採用）, HRテクノロジー, チームビルディング支援, オンボーディングツール, 従業員エンゲージメント向上, 離職防止",,,
イージーソフト 株式会社（ハーモス経費）,イージーソフト株式会社は、2000年の設立以来、経費精算領域の専門企業として20年以上の実績を有する経費精算システムのパイオニアです。 「HRMOS経費」は、社内で発生する交通費精算や立替経費精算、請求書処理の効率化を実現するサービスです。基本プランに豊富な機能を搭載しており、申請者、承認者、経理担当者の業務負荷を大幅に削減し、経理DXを促進します。電子帳簿保存法・インボイス制度に完全対応しています。 2022年3月より株式会社ビズリーチの子会社となり、2022年11月より「HRMOS」シリーズとして「HRMOS経費」の提供を開始し、更に使いやすいサービスの開発や、サポート体制の拡充を推進しています。 ■「HRMOS（ハーモス）」シリーズについて ビズリーチが提供する、採用から入社後の活躍までの人事業務支援と従業員情報の一元化・可視化により、データに基づく人財活用を実現するサービスです。経費精算システム「HRMOS経費」、勤怠管理システム「HRMOS勤怠」、労務給与管理システム「HRMOS労務給与」、採用管理システム「HRMOS採用」、人財活用システム「HRMOSタレントマネジメント」、を展開しています。,"HR EXPO （人事労務・教育・採用）, 会計・財務 EXPO, 勤怠管理システム, 経費精算システム",,,
Wevox（ウィボックス）,アトラエは、「世界中の人々を魅了する会社を創る」というビジョンを掲げ、2017年にWevoxサービスを開発しました。 Wevoxは、エンゲージメントの測定と向上を支援する組織力向上プラットフォームです。 このサービスは、組織のカルチャーや個人のパーソナリティ特性を可視化し、組織のパフォーマンスを高めるための様々なプロセスや活動をサポートします。 「自分の組織は自分たちの声でつくる。そんな組織づくりを信じています」 私たちは、あなたが活き活きと働くことが世界を変えると信じています。 あなたのチームや組織は、あなた自身の声だからこそ作り続けられるのです。 自分たちの声に耳を傾け、その声をもとに変革を実現することができるからです。 もちろん、自分たちで組織やチームを作り上げることは簡単なことではありません。 だからこそ、私たちはあなたと共に伴走し、チームが「組織力」を自ら高め続けられるようサポートしてきました。 活き活きと働くあなたが持つエネルギーや可能性、そのような人が集うチームから生まれるアウトプットが、あなた自身も、あなたの周りも豊かにしていくと信じています。 Wevoxは、「私たちの声で組織を良くしていこう」というメッセージを込めたサービスです。 私たちと一緒に、自分たちの声から始まるチームづくりを進めていきましょう。,"働き方改革 EXPO, HR EXPO （人事労務・教育・採用）, 健康経営 EXPO, 特別企画 中小企業支援ワールド, テレワーク・ハイブリッドワーク支援, チャットボット・ナレッジ共有, その他 DX・働き方改革関連サービス, HRテクノロジー, ピープルアナリティクス, エンゲージメントツール, 社員研修サービス, チームビルディング支援, オンボーディングツール, 従業員エンゲージメント向上, 従業員意識調査, コミュニケーションツール, 離職防止, メンタルヘルスケア/ストレスチェック, 従業員エンゲージメント",,,
株式会社 Willings,インド工科大学全23校から企業にマッチするエンジニアをインターンシップ経由で採用が可能です。採用支援だけではなく、永続的な同校からの採用ルートを確立し、AI、データサイエンス、ブロックチェーンなどの最先端IT技術領域を得意とする人材確保に今後困らない体制作りを支援させていただきます。 インターンシップ中にも弊社スタッフが並走し、コミュニケーションの活性化、異文化理解、雇用体制の整備を推し進めます。また外国人IT人材の入社時に負担となる、各種来日手続きや来日後の生活立上げなどのサポートも全てワンストップで対応いたします。,"HR EXPO （人事労務・教育・採用）, ハイクラス人材採用, 採用代行・コンサルティング, 外国人雇用サポート, その他 採用サービス",,,
株式会社 ソリューション・アンド・テクノロジー,人事・経理・総務業務のERPソリューション「WiMS/SaaS」を提供しています。コンサルティングから初期設定支援、運用開始後のアドバイザリーまで一貫した自社体制でSaaS提供を行い、大手企業の多様な働き方・DXを強力にサポートしています。 HRソリューションに加え、同シリーズ内で会計フロント機能もラインナップしておりますので、バックオフィス全体最適化に向けた段階的な機能拡張が可能です。経理業務も含めた業務改革・DX推進に貢献いたします。 1995年の設立以来、人事・会計分野のERP導入コンサルティングを手掛けてきたSOLTYは、業務効率化から全体の最適化へと進化する企業のニーズに、クオリティ重視のソリューションサービスで対応してまいります。,"HR EXPO （人事労務・教育・採用）, 社内申請・ワークフロー, 人事管理システム, 勤怠管理システム, 人事評価システム, 労務管理システム, 会計システム, 経費精算システム, 請求書の電子化",,,
株式会社Mimosa,HR Shorts は、人事/採用向けの動的コンテンツの作成および配信ができるシステムです。 インナーブランディング（エンゲージメント向上、Wellbeing、DX、社内広報、公募等）や、アウターブランディング（採用、社外広報等）において、企業が伝えたい情報をショート動画で魅力的に発信することができる新しいサービスです。 例えば ①「絶対採用したい」と考えるキーマン採用において、 特別な体験・動画コンテンツを簡単に作成することができ、スカウト返信率や内定承諾率向上に寄与します。採用競争力がより一層求められる昨今において、上質な採用体験を実現します。 ②社内の情報階層が深く、発信をなかなか見つけてもらえない＆読み切ってもらえない。。という企業様には、ビジュアルで訴求する、情報伝達の入り口としてショート動画が最適です。 他にも、 スカウト返信率を上げたい／内定承諾率を上げたい／辞退率を下げたい／情報の理解促進に繋げたい／申込み数を上げたい／等。 人事の皆様の取り組みに寄与するようにという思いで、人事/採用経験者が開発したサービスとなります。 ぜひ貴社の人事/採用活動がより良くなるよう、HR Shortsをご活用ください！,"HR EXPO （人事労務・教育・採用）, 福利厚生 EXPO, 総務サービス EXPO, PR EXPO, その他 オフィス向けサービス, BPO（業務代行）サービス, HRテクノロジー, 採用代行・コンサルティング",,,
エデン 株式会社,,HR EXPO （人事労務・教育・採用）,,,
株式会社エフアンドエム,オフィスステーションは、株式会社エフアンドエム（東証スタンダード：4771）が提供するアラカルト型 人事労務クラウドソフトです。株式会社エフアンドエムは「サービスの水道哲学」の実現を目指し、あらゆる事業者のバックオフィス業務を改善することを使命としています。,"HR EXPO （人事労務・教育・採用）, 勤怠管理システム, 労務管理システム, 従業員エンゲージメント",,,
株式会社 FCE,"4600社以上の企業様の人財育成、研修、組織作りの支援をしてきたFCEが提供する社員教育プラットフォーム「Smart Boarding」。 研修・人事コンサルティング会社が提供するからこそのコンサルティングサポートで、eラーニングツールにとどまらず、企業の人事課題、組織課題を解決に導きます。 ﻿昨対160％成長、継続率99％、研修満足度94％、利用者数40,000人突破BOXIL SaaS award　ｅラーニング部門で8部門中5部門で第1位を獲得！ その他、評価制度構築支援、新入社員、管理職層研修など、幅広くご対応が可能です。","HR EXPO （人事労務・教育・採用）, 社員研修サービス, 人材育成コンサルティング",,,
株式会社 M-ITコンサルティング,■コンサルタント業(クライアント企業の事業推進に向けた、組織や人財の改善・育成) 1.リサーチ／調査診断（組織診断、人財診断等）による現状解析 2.コンサルティング／戦略構築、組織構築、人事制度改革等 3.トレーニング（研修）／管理層開発プログラム、キャリア開発プログラム、OJT推進プログラム等,"HR EXPO （人事労務・教育・採用）, 社員研修サービス, 階層別研修, 人材育成コンサルティング, その他 教育・人材育成サービス",,,
株式会社 エルテス,,PR EXPO,,,
株式会社 オトバンク,"「audiobook.jp 法人版」は、ビジネス書や自己啓発書を中心に15,000点以上ものタイトルを全て音声で好きなだけ聴くことができる法人向けのオーディオブック聴き放題プランです。通勤中や家事中、就寝前など、耳のスキマ時間に音声を再生するだけで読書ができるため、学習のハードルがぐっと下がります。 日本の人事部「ＨＲアワード2022」で優秀賞を受賞するなど人材育成のツールとして高く評価され、現在130社以上にご導入いただいています。 当プランでは経営者や人事のおすすめ書籍や、社内報・研修などのオリジナル音源を社員に配信できる「社員専用ブックリスト」のほか、社員のコンテンツ視聴状況を見える化できる「利用状況レポート」など、当プラン限定の機能も提供しています。 さらに、導入企業向けに毎月のセミナー開催や、社員の課題スキルや職種別におすすめ書籍を公開するなど、初心者の利用や継続学習を促すサポートもしています。","HR EXPO （人事労務・教育・採用）, 社員研修サービス, リスキリング支援, デジタル人材育成, その他 教育・人材育成サービス",,,
株式会社 openpage,弊社は、デジタルリクルーティングプラットフォーム「DRP」を提供しています。候補者との緊密なデジタルタッチポイントを設け、面接から内定、入社に至るまでの候補者体験を革新します。 「候補者専用ページ」では、面接のアジェンダや議事録をリアルタイムに共有し、候補者との認識のズレを防ぎます。また、画面共有機能で面接記録を作成し、議事録の作成工数を削減します。 内定後は、「デジタルタスクガイド」で入社手続きをデジタル化し、進捗状況を可視化。マニュアルコンテンツとタスクを連動させ、候補者へのガイダンス工数を削減します。候補者ごとの対応状況やエンゲージメントをリアルタイムで把握し、内定辞退リスクを回避します。 さらに、入社後の教育にも対応。体系的なオンボーディングプログラムをデジタルで提供し、早期戦力化を支援します。 DRPは、候補者体験を重視した選考プロセスを実現し、優秀な人材の獲得と定着を可能にします。,"HR EXPO （人事労務・教育・採用）, 採用管理システム, 採用ツール作成",,,
株式会社 カオナビ,"株式会社カオナビは、社員の個性・才能を発掘し、戦略人事を 加速させるタレントマネジメントシステム「カオナビ」を提供しています。 企業の人材情報をクラウド上で一元管理し、社員の顔や名前、 経験、評価、スキル、才能などの人材情報を可視化することで、 最適な人材配置や抜擢といった戦略的なタレントマネジメントの 実現を支援しております。 現在では3,600社を超える企業・団体にご利用いただき、国内No.1シェアを獲得しています。 タレントマネジメントシステムのリーディングカンパニーとして、 「“はたらく”にテクノロジーを実装し、個の力から社会の仕様を 変える」というパーパスの下、テクノロジーによって一人ひとりの 個性や才能を理解することで、個人のキャリア形成や働き方が 多様化される社会の実現を目指してまいります。 また、労務管理システム「ロウムメイト」や予実管理システム「ヨジツティクス」も新たに提供開始！","HR EXPO （人事労務・教育・採用）, 人事管理システム, 人事評価システム, 労務管理システム, 従業員エンゲージメント向上, 離職防止, 予実管理システム",,,
株式会社 KAKEAI,「あなたがどこで誰と共に生きようとも、あなたの持つ人生の可能性を絶対に毀損させない。」をパーパスに掲げる株式会社KAKEAIは、日本企業で初めて世界のHR テクノロジースタートアップ30社に選出されるなど、“次のHR tech “企業として、新規性や実績を高く評価されています。1on1支援クラウドKakeai（カケアイ）は、2023年3月現在、世界43カ国でご利用いただいており、国内においては、従業員数名の企業から数万人の企業、病院、学校、保育園、介護施設、飲食店等、あらゆる組織、あらゆる職種の皆様へご提供しています。,"HR EXPO （人事労務・教育・採用）, テレワーク・ハイブリッドワーク支援, HRテクノロジー, ピープルアナリティクス, エンゲージメントツール, 従業員エンゲージメント向上",,,
株式会社カケハシ スカイソリューションズ,採用成功支援（新卒・キャリア）、社員戦力化のための研修・教育支援、定着・離職防止サービスをワンストップで提供しています。のべ1万社以上の実績があり、そこで培ったコンサルティング力だけでなく、クリエイティブ、デジタルを組み合わせた独自のソリューション設計に強みがあります。,"HR EXPO （人事労務・教育・採用）, 社員研修サービス, 階層別研修, 人材育成コンサルティング, 採用ツール作成, ハイクラス人材採用, 採用代行・コンサルティング",,,
株式会社ココナラ,株式会社ココナラは、個人が持つスキルや知識を活かしてオンラインでサービスを売り・買いできるスキルマーケット「ココナラ」を運営しています。 さらに、エンジニア・デザイナーなどのテック人材を業務委託で紹介する「ココナラテック」、手間のかかる日常業務や、1人雇うほどではない専門業務などを、フルリモートの優秀なアシスタントにまるっとお任せできる月額制サービス「ココナラアシスト」、ココナラが契約主体となりハイクラス実名クリエイターを紹介する「ココナラプロ」、オーダーメイドの参画方式で経営や各分野の専門人材に依頼・相談できる「ココナラコンサル」の4事業を展開しています。 全ての企業さまが、最適な人材を、最適な方法で活用できるように、あらゆるサービスをご提供しています。,"働き方改革 EXPO, HR EXPO （人事労務・教育・採用）, 会計・財務 EXPO, 法務・コンプライアンス EXPO, 総務サービス EXPO, PR EXPO, 健康経営 EXPO, 名刺作成, BPO（業務代行）サービス, その他 DX・働き方改革関連サービス, 人材派遣, その他 採用サービス, その他 経理・財務・税務サービス, 広報業務支援サービス",,,
株式会社 リーディングマーク,「ミキワメ」とは、①人の性格を明らかにする【適性検査機能】と②心の幸福度（ウェルビーイング）を可視化する【エンゲージメントサーベイ機能】を併せ持つサービスです。 企業ごとで異なる採用の人物像を明らかにし、自社で活躍する人材を見定めることができるツールです。社員の性格データを元とした自社独自の採用基準が作成できるため、候補者のおすすめ度が表示され、採用すべき人材かの判断に役立ちます。,"HR EXPO （人事労務・教育・採用）, 人事管理システム, HRテクノロジー, エンゲージメントツール, 採用管理システム, 健康管理システム",,,
Guidable株式会社,弊社は『外国人採用を当たり前に』をバリューに掲げて、 日本に住む外国人に特化した214カ国23万人が登録する国内最大級の求人サービスを運営しております。 登録者の方は、永住者 / 定住者 / 配偶者の在留資格を中心とした 就労の制限のない方なので、正社員・アルバイトを問わず色々な職種で採用可能です。 外国人採用のプロがサポートさせていただくので、安心してご利用頂けます。 【サービス内容】 ◎求人掲載→登録者23万人の在留外国人に特化した国内最大級の求人媒体に掲載 ◎集客（独自プロモーション）→Facebook広告などで能動的に集客(全国平均応募数15名/月) ◎一次選考→スクリーニングと同時にミスマッチを防げる,"HR EXPO （人事労務・教育・採用）, 外国人雇用サポート",,,
